{
  "title": "一条待验证的工作顺序",
  "direction": "LR",
  "nodes": [
    {
      "id": "n1",
      "label": "澄清需求",
      "itemIds": [
        "22222222-2222-4222-8222-222222222222"
      ]
    },
    {
      "id": "n2",
      "label": "定义验收结果",
      "itemIds": [
        "11111111-1111-4111-8111-111111111111"
      ]
    }
  ],
  "edges": [
    {
      "source": "n1",
      "target": "n2",
      "kind": "hypothesis",
      "label": "建议顺序，非原文已证实因果",
      "itemIds": [
        "11111111-1111-4111-8111-111111111111",
        "22222222-2222-4222-8222-222222222222"
      ],
      "relationIds": []
    }
  ]
}
